{
  "case_scope": "single_candidate",
  "facts": [
    {
      "confidentiality": "usable",
      "conflict_state": "clear",
      "evidence_state": "verified",
      "fact_id": "F-001",
      "fact_type": "experience",
      "signal_bindings": [
        {
          "kind": "requirement",
          "signal": "terraform"
        }
      ],
      "signal_relation": "supports",
      "source_ids": [
        "FS-001"
      ]
    },
    {
      "confidentiality": "review_required",
      "conflict_state": "clear",
      "evidence_state": "verified",
      "fact_id": "F-002",
      "fact_type": "constraint",
      "signal_bindings": [
        {
          "kind": "requirement",
          "signal": "terraform"
        }
      ],
      "signal_relation": "unknown",
      "source_ids": [
        "FS-001"
      ]
    }
  ],
  "locale": "en",
  "schema_version": "candidate-fact-matrix-v1",
  "signal_vocabulary": "candidate-claim-signal-v1",
  "source_snapshot": "snap-candidate-facts-sha256-589eadcea071ecc2e3aa2f8b97b3783daab56204121f4e61d3dc44546ec6adc6",
  "sources": [
    {
      "captured_at": "2026-08-24T12:30:45Z",
      "evidence_state": "verified",
      "source_id": "FS-001",
      "source_type": "verified_record"
    },
    {
      "captured_at": "2026-08-24T12:30:45Z",
      "evidence_state": "candidate_reported",
      "source_id": "FS-002",
      "source_type": "cv"
    },
    {
      "captured_at": "2026-08-24T12:30:45Z",
      "evidence_state": "inferred",
      "source_id": "FS-003",
      "source_type": "portfolio"
    },
    {
      "captured_at": "2026-08-24T12:30:45Z",
      "evidence_state": "unknown",
      "source_id": "FS-004",
      "source_type": "candidate_statement"
    }
  ]
}
