{
  "case_scope": "single_candidate",
  "facts": [
    {
      "confidentiality": "usable",
      "conflict_state": "clear",
      "evidence_state": "verified",
      "fact_id": "F-001",
      "fact_type": "experience",
      "signal_bindings": [
        {
          "kind": "requirement",
          "signal": "terraform"
        }
      ],
      "signal_relation": "supports",
      "source_ids": [
        "FS-001"
      ]
    },
    {
      "confidentiality": "usable",
      "conflict_state": "clear",
      "evidence_state": "verified",
      "fact_id": "F-002",
      "fact_type": "constraint",
      "signal_bindings": [
        {
          "kind": "eligibility_gate",
          "signal": "country_geography"
        }
      ],
      "signal_relation": "contradicts",
      "source_ids": [
        "FS-001"
      ]
    }
  ],
  "locale": "es",
  "schema_version": "candidate-fact-matrix-v1",
  "signal_vocabulary": "candidate-claim-signal-v1",
  "source_snapshot": "snap-candidate-facts-sha256-ee110125caca464ecba6fd9f7d7a16896fc53ee48d26f1b520da931512c369a7",
  "sources": [
    {
      "captured_at": "2026-08-24T12:30:45Z",
      "evidence_state": "verified",
      "source_id": "FS-001",
      "source_type": "verified_record"
    },
    {
      "captured_at": "2026-08-24T12:30:45Z",
      "evidence_state": "candidate_reported",
      "source_id": "FS-002",
      "source_type": "cv"
    },
    {
      "captured_at": "2026-08-24T12:30:45Z",
      "evidence_state": "inferred",
      "source_id": "FS-003",
      "source_type": "portfolio"
    },
    {
      "captured_at": "2026-08-24T12:30:45Z",
      "evidence_state": "unknown",
      "source_id": "FS-004",
      "source_type": "candidate_statement"
    }
  ]
}
